timestamp,reviews
2024-01-07 09:48:27,"The results from the provided suggestion lasts only for sometime, the app starts lagging again, it is not convenient and a viable solution at all. Constant anomalies poses a highly inconvenient user experience, and a risky bug to have during the execution of trades. Other than this, Binance is above all other exchanges. It would be great if the Binance team could take this issue seriously and solve it at the earliest. Hoping for the best! âœŒ"
2024-01-04 21:46:48,"The interface is not user-friendly for newbies. It doesn't give me ease of access to my P&L charts since the time of investment... Only shows 3 months of data at a time. Atleast like other apps we could see our PNL percentage. The app is wierd with many technical complicated features making it difficult to optimise its use. The app has technical issues, sometimes it keeps showing me white screen saying that there is network issue but there is t any as other apps are working just fine."
2024-01-24 14:14:16,"I've been using your app for about a month now with no issues whatsoever, absolutely loved it compared to your competitors. However, something happened, and it keeps on crashing since 2 days. I try to start it, it appears on the home page for 2 seconds and then switches itself off right away. It gives me the option to send feedback, but whenever I try to do so, it won't take me any further. I restarted my phone, reinstalled the Binance app, tried WiFi and mobile data, and I have enough memory."
2024-02-25 05:19:34,"It kept crashing. It started Immediately after I log in. I've cleared cache, cleared storage, reinstall, but no difference. I couldn't even do anything on the app. After I sign up and the interphase shown, it will just load and then go blank. I won't be able to return to homepage or do anything. So it's not really possible to contact on the app support page"
2024-04-12 05:03:53,"I've been using your app for about a month now with no issues whatsoever, absolutely loved it compared to your competitors. However, something happened, and it keeps on crashing since 2 days. I try to start it, it appears on the home page for 2 seconds and then switches itself off right away. It gives me the option to send feedback, but whenever I try to do so, it won't take me any further. I restarted my phone, reinstalled the Binance app, tried WiFi and mobile data, and I have enough memory"
2024-04-13 05:02:56,"Binance is beginning to fail greatly. Their systerm is no more efficient. The app crashes 30 after I launches it. The awful experience continued for days and I uninstall and installed it back and the worst happened. After adding my email address they would tell me that the email is not valid which is a lie. Even my phone keyboard has my email address that each time I need to put email address on anything, it would appear correctly. But balance why? What is wrong with you guys?"
2024-04-16 11:12:19,"Exceptionally difficult to get money back out into Australian $. Online instructions all appear to be from 2017. I'm not a crypto wiz, maybe for someone who is more experienced it makes more sense but CoinBase was super easy to figure out without instructions, unlike this one."
2024-04-06 09:51:26,"A great app. It's been evolving consistently. However, now takes longer to load and sometimes inconvenient. Edit: The Binance app updated itself (auto update on Playstore is turned off) on 29th March 2024 and the new version doesn't show Futures Trading nor opened positions in futures or in the wallet. Edit: Clearing the cache and changing the language solved the problem."
2024-03-27 20:49:28,"I have been having trouble depositing zar into my account for weeks, I have followed all the steps and I even opened another bank account however it seems like it's a waste of time because even with the p2p option the verification code keeps on changing when you check your email. It's by far the most difficult investment platform I have used."
2024-03-26 11:57:52,"Use Code while signup to get free trading fees. Its great app. But it gets good features and good setup on a mobile device. Trading do get better the more you use. Nothing mind-blowing, but they do smooth out. Mobile Royale is a short match in smaller areas that are good for a couple apps while waiting for a pizza or something. I don't get these one star reviews about crashing and glitches. I don't have a great phone Galaxy S20, but I haven't had any issues. So far it's enjoyable and I like it."
2024-04-10 16:32:31,"Of all the most irritating apps to use, Binance can top the list. The app keeps stopping seconds after you attempt to run it. I was doing a p2p transaction trying to release assets and it stopped in the middle then I was suspended for some days. I have compared it to other heavier apps but those won't stop. I have done all steps clearing cache and uninstalling it but still have same experience. Kindly release a stable version."
2024-04-10 14:15:39,"The app is user friendly though, but just of recent the app keep crashing and become inaccessible. Have unistalled and re-install again but nothing changed. Pls help do something about it. Again the website too is not accessible since the app keep crashing I tried to access it through the website but the website too is not loading."
2024-04-04 14:18:39,"I will give this app a one star rating because every time I open the app, close it and open it again, the app doesn't work it's loading loading and loading, then I have to delete it again and reinstall it. Or later i have to clear it's storage and log into it again and do everything sign up again once done then close again then open again then this problem comes."
2024-03-29 00:05:16,The continuous crashing of the web3 is very annoying please fix it up. Again I noticed a fictitious re-swaping of my coins on the web3 still trying to figure out what actually happened. I no longer trust the Binance Web3 because it seems funds are no longer safe.
2024-03-31 16:55:10,"Used to be great, but now seems to be riddled with issues. They may be the biggest, but are not the best, by far! I'd use Kucoin or just DEFI to save yourself several headaches! Since my previous review they have stopped staking, withdrawals and several other services in the UK. Pretty depressing to be honest, I've made some money, but cannot get it out of Binance, so they are literally holding my money hostage!"
2024-03-31 13:04:52,"Here's a draft for your feedback: --- Subject: Feedback for Binance Dear Binance Team, I hope this message finds you well. I've been using Binance for some time now, and I wanted to share some feedback with you to help improve the platform. 1. User Interface: Overall, I find the user interface to be intuitive and easy to navigate. However, I believe there could be some improvements in terms of streamlining certain processes and making key features more prominent. But he is app very good ðŸ’¯"
2024-04-06 04:11:10,"The app right now is nothing but trash and needs to be fixed,whenever I try to open it,it says network abnormally and then freezes on its own,I have to close and reopen the app plenty of times before it works, I'm new to this app so it's a really bad experience for me,fix your network issues"
2024-03-25 07:06:27,"Constantly getting ""Sessions has expired"" loops, no matter how often I try to login, which have me force stop the app. Now I am again unable to log in with the app showing me an empty error message that I need to confirm with an ""I understand"", which I clearly don't since the text box of the error is empty. Currently absolutely unusable."
2024-04-11 01:13:43,"I can't reach support team via the app rather can I buy put option or buy sell options without passing a test which shows a blank page despite all necessary problem shooting resolved taken. I wish they allow skip test it would have been better that way. Support is necessary to easily navigate to, I advise. I TRIED ALL WHAT YOU SUGGESTED WITHOUT ANY POSITIVE CHANGE, STILL THE TEST AND THE SUPPORT PAGE IS BLANK"
2024-03-28 01:37:02,"the app keet on crashing, i do try to reinstall and restart my device but still keep crashing and verification failed even i entered correct password, used my finger print, pattern. i try all types of log in, finger print, email, face detecting and pattern but still i cant log in always says expired, how can it be ny log in is expired, please help me on this."
2024-04-09 02:21:30,It keeps disabling my account after trying to withdraw BTC into wallet addresses. Happened twice and it's getting annoying - I've just tried to login and it keeps saying login expired after literally entering in my verification codes. Happened twice and now it says try again later cause I can't request codes to get into my account
2024-03-26 12:16:22,Enter Code while signup to get free trading charges. This binance app interface is actually really good. But some features are pretty low and it is extremely complicated at first takes u a long time to know what are the use of each items and emblems and how to use them. That is not a had thing in my opinion. The community is kinda trash. The matchmaking time is short. The different modes are also fun. Overall a very amazing game. Definitely one of my top fav.
2024-04-03 14:27:45,"Removing 2 starts due to the extremely buggy Web3 wallet. Binance is possibly the best centralized exchange and it's app has plenty of functions and instruments for trading and staking crypto. It's a shame that their Web3 wallet is far from functional - stay away from that, use the main exchange app and you will be fine."
2024-04-14 14:42:09,The binance app and the authenticator app are both not working. Whatever code the authenticator app generates is not being accepted by the binance app and they are using this reason not to give me any rewards at all. Whether the welcome reward or paticipating in other activities for rewards. I'm so sick of it. I even want to delete the account because its completely USELESS.
2024-03-31 00:40:41,"I think it's great, but I only had one problem and that was with a deposit of LTC that was not received or refunded due to minimum deposit amount. I just don't understand where the LTC went if it neither was credited or refunded! Kind of strange is it just floating around in the blockchain? Support just said that they could not give further assistance due to ..."
2024-04-05 06:07:08,"I unistalled last nd again reinstall but its showing blank nd after crashing app has close, as i didn't open beforel nd i have a suggestion for your developer team, plz make sure that this or upcoming update will be work on at least 6.0.1 nd newer also, iam using 6.0.1 version but your app has too many bugs for this version plz solve this issue, i cleared cache memory again nd again but its behave like a unrated apps, i really didn't find this type of app which crashed while using plz solve this"
2024-04-01 08:35:02,Trades I make on the website are not showing on my app in the trade history and trades I make on the app aren't showing on the website trade history. You think it would link properly since its the same account. Website trades are at market value but I've noticed around a 0.7% premium paid when buying crypto on the app and the same when selling (= 1.4% spread). App doesn't have an option for candlestick graphs and isn't easy to navigate. I much prefer the Web platform.
2024-03-25 12:29:38,Real bad app I transfer money from spot wallet to Funding wallet now the balance is showing in funding wallet but can't transferable to another. Really bad don't Install it use another broker instead. I deleted it and even it not remember some one data like especially settings and Giving tutorial to experience traders too .
2024-03-13 16:55:34,"You didn't understand me. I want to choose stop loss price from the chart. But I can't because numpad is visible on top of the chart. When I close numpad, the stop loss field loses focus. I don't want to use the numpad. I want to choose from the CHART. I cleared the cache but no good. I will never update app again once this is corrected"
2024-03-30 18:21:36,"I have been using the app about more then 6 month it was perfectly fine but since the last update , I dont know what's wrong with it's not work correctly show error and says (code 141004 ) and the next page like launchpot and other section which I tying to open it doesn't work properly that way I edit my last post and I give the app 3 stars."
2024-03-27 07:32:56,Overall good wallet but apparently from the desktop app I have 10+ payments method. However from my phone app I have barely 3 which is really bad. Because I don't use these 3 and I'm not using desktop as much as I use the phone and I can't all the time. This means I might miss something big. Why is there no deposit with debit card option in my phone app...
2024-03-24 04:28:42,App is good but I lost it's very difficult to get pass verification I did all crazy things app asked me to do but still verification failed. it should be made easy for people to recover account and remove Google authenticator and change email but no I have been trying to get pass verification for close to a month now yet no avail it's frustrating and dam tired of this nonsense. It should be made easy so you avoid 1 person having multiple accounts with different names in your system. Time wasted
2024-04-02 08:41:41,"easy to use once you know how to use it. It takes some time, but the tutorials that explain how to do what you need to do is clear. the app runs smoothly and efficiently. my only problem is the withdrawal system..it's always down for some reason. but otherwise good and easy to use and play around."
2024-04-12 14:51:39,"Hello,Hope you are well. I like to raise an issue here I have binance installed in my phone for years but now when I try install the updates it fails after completing the loader is reached to the %100 mark and this happened couple times for many days.I don't know why it happens. Can you please me to resolve this issue that would be great. Thanks. Regards Daniyal Anjum"
2024-04-09 00:28:34,I have been using this app for a few days now. It's a nice app and I would have given a better rating if not for the fact that I can't seem to be able to log in to my account since yesterday. It keeps telling me I have no available passkeys to login on my device ðŸ˜’ðŸ˜‘. I have been trying to reach customer support but it always says webpage not available. Please note that this is my only device. There is no old device.
2024-03-19 00:32:28,"I've invested into coins few years back and it's impossible to export my trade history. I can't export history to do my taxes. Also, selecting date range is horrible. Limiting history to 6/12 months is super annoying. I would understand, if I have 1000 transactions, but I only have 10 someting of them. Your server can handle showing all my transactions at once."
2024-03-23 02:01:27,"app shows false chart info indicating a coin has been sold, which might make users buy at terrible times. this happens when switching between apps. restart required. trading fees are misleading because buying fees are not the same as selling fees. i believed i was making profit with my small savings, then realized i didn't even cover the transfer fees from or to my credit card."
2024-02-24 23:04:07,"I have been trying to create my web3 wallet, and the system works terrible. It gets to 11% creating and and error is flagged, always the same. I have tried several times. I unistalled and installthe app again. Iturned off and on the phone and the same issue. I cannot contact anyone to help me create this. What can I do? I find it useless without this feature."
2024-03-20 13:18:45,"It was a good app, for a while. I failed autentification 5 times. With multiple videos. I made a few videos myself, then they wanted With somebody else. I remade those videos with my wife and it's still not enough for them. I feel like they are mocking me right now."
2024-02-27 21:34:29,"I have been using this app for a very long time now and after updating it, the issues of not having access to all the features started. I even tried to clear the cache but yet no positive results. In contacting the customer service, it will end up telling me connection error. Please, I think improvement is needed to be put in place in order to have access to all the features. Thanks."
2024-03-20 06:27:47,It's great exprience generally though the user interface in the new very is lagging. When I try getting back after clicking on something it lags. Fix on that and also make it easy to access the earn holdings easily
2024-04-16 12:52:29,"Best exchange for me I guess, it has all the stuff one would want from an exchange, and most importantly, incredibly low fees, sometimes even no fees at all. highly recommend it ðŸ™‚."
2024-01-21 19:57:34,"It's okay, it certainly trades cryptos, and quite a wide variety at that. The transaction costs aren't great. Also, the cost to withdraw if you want to store your tokens more securely is quite high. I wouldn't recommend for smaller investors. Update: they cut pretty much all the NZ services. Still meh"
2024-03-08 11:34:50,"New to crypto and heard that Binance was a good exchange to use. Just downloaded the app so at recent version and the app fails to load properly. Clicking sign up or log in does not display any page but a cross. I have not been able to create an account. Trying to access the app via my very fast stable WiFi (900mbps), some pages load but with issues on them. I will change my review when I can actually get to use the app and exchange properly. Now uninstalled"
2024-01-26 07:46:23,"Something is definitely wrong with this app. For over a month now if I open it nothing comes up , it just keeps loading for long minutes and error message pops up, I've had to go through the stress of using binance web on my chrome browser. I have uninstalled and reinstalled many times and it keeps doing the same thing, maybe I should just pull out my funds and forget about your app coz its frustrating"
2024-03-12 04:20:18,"The facial recognition process is the most tedious, annoying and inefficient process I've ever been subjected to by an app. I've spent several hours trying to get through the app's facial recognition step, all to no avail. I'll rather switch to another app if this nonsense continues, because I've already wasted several hours (previous responses where error encountered without me making any single progress). Just now, I made progress but then it tells me try again."
2024-01-28 13:08:23,"My experience with Binance has been so far terrible. Particularly withdrawal process. Binance is not honest with their customers and cannot say, ""hey we don't like you withdraw your money"", instead they put too many hurdles call it ""client security"". As a customer I never asked for extra layers of security but they keep putting new ways to collect as much information as possible. They find any minor reason to freeze withdrawal for 24 hours or longer. Do not recommend. Avoid if you can."
2024-01-28 08:47:18,"Application crash again and again look like application do not support android 7 and below. Dear Developer please check and resolve and identify the crashing issue. Have already tried to open application after cleaning cache but no use. application behave on closing and crashing. I think it's better to upgrade and update. Nothing change even after updating the application. I do not, what's wrong with this application. even my friend is also facing same issue. May be application developer failed"
2024-01-19 12:18:30,My experience with the Binance platform was amazing in everything related to digital currencies and trading. It is the number one platform in the world so far. I hope to solve its security and financial problems so that it improves for the future. I recommend it.
2024-03-17 13:53:04,"Enter Code while signup for $50. Binance is great but I've spent about a year in trading & used about 10 minutes in match play, not even a full game. Too complicated, too many mini games, required training, and reward claiming. I would love to quickly get into a match but I still need to complete some training and don't know where to go. Even then, it seems like this game is more about menial quests, rewards, and specialized games than normal soccer matches. I'm done with this game. Not for me."
2024-01-30 08:57:24,Everything is fine But you have to focus on drawing Tools. That helps a lot if you add a long short postion (risk reward tool) and some others like when we open a position in futures there should be a option to see over position on large screen and option to trail your stop loss easily... Like in an Indian crypto exchange (Delta exchange)
2024-02-01 14:38:44,"As a digital currency trader, my experience with Binance Trading Software has been fairly standard. Here's my evaluation of it:Firstly, the interface design of Binance Trading Software is clean and straightforward, with a well-organized layout that makes it relatively easy to navigate. However, compared to other trading platforms, the interface feels somewhat ordinary and lacks some personalized design elements.Secondly"
2024-03-15 12:42:55,"For the past 2 weeks, most of the features have not been responding and I got intouch with the customer support through X twitters and I have done all I was told but it has remained the same.I like to point out that it is even worse now..I keep getting feedback the same feedback clear your cache, reinstall ,switch off and that I should check my network which i have done but my other apps are functioning well.Please you need to look into it"
2024-03-03 15:42:57,"The amount that I have transferred is not matched with what I got in my wallet. They took advantage with converting the currencies. They said, the price was fluctuavie meanwhile, I sent them the Google and Coingecko prices were mentioning the huge difference. Ridiculously they were insisting that the purchase was right. It's not recommended to everyone."
2024-02-29 12:40:45,"I cannot scroll my position or orders tab (if more than to orders or positions) all the way down at futures, when chart is open on the bottom. The last one is always behind the chart and no choice other than closing down the chart. This is very annoying, and couldnt be so hard to fix it!"
2024-02-24 19:18:15,"I've been using the Binance app for a while now, and I must say, it's been a game-changer for my cryptocurrency trading journey. Here's why I love it: User-Friendly Interface: The app's interface is incredibly intuitive and user-friendly, making it easy for both beginners and seasoned traders to navigate through different features and functionalities without any hassle. Speedy Transactions: One of the standout features of the Binance app is its lightning-fast transaction speed."
2024-02-16 10:36:33,"I am getting a lot of messages with ""network anomaly,"" which is super annoying, and it's been happening for a while. I wish you would fix this. I have done it all. Thanks. Will let you know and change the review if fixed. BTW, Super is listed as superfarm, and it's been ""superverse"" for a while... confusing ðŸ˜•"
2024-02-18 11:58:06,"-strict limitations to what you can do from which country, a nightmare for people who travel a lot -everything keeps getting ""streamlined"", and every time the user loses a little bit of control over what they do -asked me to pay taxes in a country I don't even live in -poorly designed site/app trees, some basic features require quite a few clicks to reach"
2024-02-27 21:38:17,"Please try and fix the app, it is misbehaving these days. Can browse through out the net but any time you want to use this app, all you get is network Connection error. And there is nothing wrong with your network. We are losing money due to this, we can't be clear data and cache just to make the app work well."
2024-03-05 07:39:48,"It's the worst written app. Takes more than 5 times to setup security, first the page do not load then to type what you need to the keyboard does not open. Adding a pin says it's done by email confirmation but does not regiter on the app. Took 7 times to get email security setup. 2 hours later I finally got to Withrow my funds with 3 2 factor security. Does not register changes and constantly asking for more information, typical scam signs. Also unable to unlink banking details. Dont trust it.."
2024-03-05 05:31:22,"This app has been frustrating me, since ever I'm using it, when I try to open the app, it doesn't open, rather it keep loading loading and goes completely blank, keep wasting my time, the only way I can use this app is to uninstall it and install it again, then it'll open, if I use it for that time, later on, if I come back to the app, it will not open just blank, untill i have to reinstall it again, continuosly, this process is frustrating, and giving me a bad experience with this app"
2024-03-13 00:31:04,"It was working well for me but recently when payment options were removed, u only allow a Visa card and I don't have one.secondly bank transfer photo I'd isn't recognising a valid driving licence and saying it's not a valid I'd document for the country?! I mean what the..iv been missing so much n can't use it anymore for transferring money in n out.please resolve this!"
2024-03-05 12:13:10,"1. **User-Friendly Interface**: Binance app offers a seamless user experience with its intuitive interface. Navigating through various features such as trading, deposits, and withdrawals is effortless, making it ideal for both beginners and experienced traders."
