timestamp,reviews
2024-02-26 11:49:11,"Please what is happening, I was unable to withdraw, then I decided to uninstall and reinstall the app, now I cannot access my account. I was able to later withdraw smoothly from the website without issues using opera mini browser after several failed attempts with chrome. But the app is still not working, please kindly fix it."
2024-03-17 01:01:19,After new update My Binance App is crashing continuesly and I'm unable to login back to my Binance account. It closes automatically. I have tried dozens of times but still it's closing by itself. Kindly resolve the issue as soon as possible as I'm currently in a trade. It could be a huge loss for me.
2024-02-24 17:22:11,"I have changed my mobile, unfortunately my Binance is not opening. There is a lot of fund in it. If it asks for a pass, give it, but it is not giving the option. Just write that it is..YOU don't have an available passkey to complete verification on current device.While I had put the finger and Gmail is also there, the password is also there is also the finger. Now what is the solution to open it and start working?"
2024-03-04 23:18:54,"The app only offers 1 payment method ""bank transfer"" and unfortunately neither visa nor mastercard accounts work (both cards cannot be used. I attempted to add google pay, that also does not work, as stated there is only 1 option that comes up when trying to buy, and that's bank transfer. This is seriously frustrating, I'm seen coins I'm trying to buy increase and I'm unable to pruchase any."
2024-03-11 12:01:27,Please and please binance fix this problem you have with your app. I've never had any problems with your app before but now I can't even login back to binance it just keeps going back to the homepage if I try. I've done everything possible to see if this problem is from my end;I'm sorry but I'm leaving a one star until you fix this problem
2024-03-17 21:00:12,"The worst trading platform ever. There is no security. Anyone can access your account and use your funds as they want and if you'll contact costumer services, first they will ask you to verify your account by email and authenticatior app code and in the end they'll say that we cannot do anything to retrieve your account sorry. And even you asked them to deactivate your account they won't do it either. Worst security ever. I'm writing this review from my personal experience. I won't recommend it."
2024-02-02 01:11:17,This app is the worst thing ever. I have been having a problem with my login where by it tells me that my account is blocked. I have tried everything even contacting support but no help has been provided for the last one month and I have lost very important transactions. If you can stay very far from this app.
2024-02-18 12:53:50,"There are much better apps for much smaller exchanges. Why can't we see the average cost, daily or 7 weekly % returns, total return of a position and the usdt value of an item in the wallet views? Now we can only see how many of that coin we have. Plus, in the overview chart, why do you group smaller items as 'Others', someone may have 100 coins for example. Purchasing and other modules are better, main problem with Wallet view. 2024 update: their app has improved considerably, so.my new 4s."
2024-03-16 15:50:37,I have an issue in my account i left the app since 1 year but not delete the account all things perfect and also my account is verify but after that suddenly I look my account than this shows an option that due to some security reason you can't continue your application in your country and withdraw all your money and also my account verification failed please solve my problem. Thank you
2024-02-19 15:54:46,"Best app to check graphs and put notifications. It is all very user friendly and clear. A pity busd isn't supported anymore for 'free trading' but it is still my favorite crypto app. Haven't tried depositing money back into my bank yet, but transferring money to the wallet is easy. Thankfully it is also still operative in Belgium."
2024-03-12 02:59:52,Was going great until today when nothing is responsive. I use app more than website. Nothing is responding. Got the update a couple days ago Update. Apparently system maintenance would be great to have an email of a date and time giving notice....abit late for developer reply co sidering it was over 2 years ago and binance is no longer usable in canada
2024-03-11 01:44:25,"Horrible app. They make it very difficult to access and use rewards, plus the rewards expire quickly. Deliberate ploy to promise rewards and not pay them out. Edit - other exchanges will just deposit rewards straight into your wallet with no issues. I'll stick to them in future"
2024-03-10 13:41:51,"ðŸ˜… Well if you respond after 3 years... I believe so >> 2021 You could improve transactions calculations views by adding more descriptive infos in the full app. There is too much stuff that could be added manually by using the settings , also the view can be checked from a drawer instead of so many tabs. Hire a better ux guy."
2024-03-05 19:45:06,"The app constantly uses a large amount of traffic, wifi or mobile, idle or active. This is probably the reason for the high battery consumption of this app. Clearing the cache, data, and reinstalling doesn't help. Support is unreachable. Only a forced stop after each use partially helps, although this is not very convenient."
2024-02-10 09:24:43,This app is getting annoying by the day. I have been using this app for a while and I've never had this kind of experience I'm. before now it's working experience was very fast and reliable but now it's working experiences annoying how can I have an app on my phone and yet it keeps freezing it will not open. whenever I am to use this app I will have to go to app settings to clear cache before using it. now I have a pending transaction and I can't even run it successfully without clearing it
2024-03-10 00:02:29,"I'd be rating binance a star cos that's what they deserve right now, I haven't been able to read notifications, posted articles and a lot more, it keeps telling me ""connection error"". When there's absolutely nothing wrong with my network. Currently using the same network binance tagged error to drop this review. EkÃº isÃ© oo"
2024-03-14 17:33:33,"Not user friendly at all. Also even though I initially managed to deposit euros via debit card, it has allowed me to deposit further. Error appears, and funds aren't transferred to Binance account! Very frustrating!! And the chat assistant isn't useful either!"
2024-02-14 20:30:44,"The 2FA is not working. I am having issues signing in my account. Even wen I click on ""This device"" on connect key, it would keep loading and won't pass that stage. If I need to use Authentication app, once I leave the Binance app to get the code, it sign me out and I have to begin the process again while the code expired. I am tired."
2024-02-29 11:08:17,"Hi developer, try to correct the select trading zone on p2p. The bottom tab does not display well on most device. The options are hidden. I have reinstall, delete, and clear cache. Still can't see p2p list on my NGN P2p. The app was perfect before your last update. But after, the NGN P2p is list is hidden."
2024-02-07 14:31:02,"My account got blocked without any reason, and I couldnâ€™t get back my money. Trying to sort it out got me nowhere, and thinking about taking them to court? Seemed like a huge challenge. Turns out, Iâ€™m not the only one with this issue. I found a lot of similar stories out there, be careful before trusting your money here or you may lose it as it happened to me. Edit: Don't call me Binancian anymore, no point on sharing the id, support was already final with his words. Talking with police soon."
2024-03-09 16:04:18,"Legit makes things way more complicated than it should be. Absolutely garbage app. I think you should add a withdraw button on the, near the deposit button on the main page. So I don't have to navigate to wallet-overview. Thanks"
2024-03-05 16:16:38,"Hi Binance, please fix your favourite dashboard, there is an issue still going up and down when scrolling. I already edit and arrange the coin but after scroll down, the apps going up again and again and difficult to scroll and check one by one on favourite. Please make it static after edit and arrange on Favourite Market Menu on your apps."
2024-02-01 18:54:48,"Best trading experiences so far and zero lost assets. Still one disturbing concern, which made one star disappear - their VISA card program for the European customers died just like that in December, although the card was released fot 3 years and should not have expired before 2025. You just don't expect this kind of mess-ups from so huge financial institutions, which are worth of billions of dollars!"
2024-01-23 05:24:03,"I've been using binance for more than 2 yrs and I've never experienced any issues with them. However, with this new update I can't access the app, the pages just keep loading without ever opening. What is the solution, binance?"
2024-03-07 09:11:40,So far I love this app.. Everything is so easy to understand. YOur simple earn products and futures are my favorite. I also love the campaigns and rewards its downside is for telegram campiagns rewards take too long to be distributed. Also can a p2p merchant be disabled after being reported cause some are becoming too much with the scams. Other than that the app works amazingly would totally recommend it
2024-02-18 19:25:04,"I have been using this app since 3 years and it is number one in the whole world..However the last update I did some days back makes the app to be slow.My phone is 8gig +6 RAM and every other heavy apps are working fine but binance once I log in, the speed of the app is very slow with this latest update."
2024-04-08 11:30:34,"Your app seems to have become ineffective as whenever I attempt to buy currency, neither photos upload from the gallery nor do messages get sent promptly. This is frustrating; please fix these issues."
2024-04-02 04:50:02,"The best and most trustworthy exchange in the world, others should learn from binance, about customer protection and prioritizing customer satisfaction over platforms interest. seriously, none come close to binance. They deserve more than five stars, getting your funds out is as easy as you got it in, not like other platforms that delists a coin without prior notice. Binance is king of all."
2024-04-02 00:56:29,I can't enter my account it doesn't allow me to it keeps stopping and restart and i did all the things that was suggested in the comments (clear casha change network and restart phone )it still doesnt work now after i enter my gmail and click on next so i can write my pass it gives me a exclamation mark and i (understand word ) that the app wants me to click on this is extremely frustrating please fix the problem
2024-04-11 06:23:35,"I downloaded and installed the app. It's saying it's not available in my country. Lol, Florida USA? No, a VPN is not being used. Problems with install and using, problems with my money? ***I opened the account on their website, same error."
2024-03-28 08:23:02,"The app was working positively. But from past three days it suddenly stopped /hanged and shows message""App stopped"" I have updated the app but still the problem is same. Very disturbing.will give 0 star if available"
2024-03-24 15:17:12,"I do not recommend, when depositing money it takes 2 seconds, if you want to withdraw it is a big challenge, 1000 steps to go through. I recommend other platforms, including Revolut, the only advantage of Binance is that there are many cryptos, but it wouldn't really be an advantage, since you can find the most important ones anywhere."
2024-03-25 22:06:52,I am trying to change my email address as i don't have access to my email and signout in binance account but i have access to my phone number only so the issue is i have submitted request through process it has asked me several times from last 2 months but my account email is not updated yet and i don't have access to my old email address which i used to use for binance account. Kindly solve my issue
2024-04-03 04:55:33,"It was very difficult to start because my mobile camera was not right and the documents were not completed and I thank my friend who kept giving me details about it. Yes, if I like it, I'll give it five stars because I've only had an account for a few minutes"
2024-04-06 10:30:03,"I used to love the app but nowadays I keep getting the network anormaly prompt and I can't even login to know how my coins on spot are doing.... it's been frustrating for months, cleared cache yet nothing has changed."
2024-03-27 13:05:16,"Please I don't understand this, account I have been using since last year just last two weeks I tried logging in the normal way I usually do and It say Binance account not found so I thought maybe I missed to update so I did, still the same, I have to uninstall and reinstall, I logged in with the same account it brought me to a new account that has nothing inside and unverified account, whereas my account has been verified and I have been trading with it, so please help I need my account back."
2024-04-08 10:02:21,"After updating, I faced crashing issues frequently. My Phone Samsung Galaxy A72 with Android 14. I am unable to use the App . Kindly resolve this issue as soon as possible."
2024-03-17 15:36:42,"Omg don't use this app! They literally stole money from me on my first wallet transfer! They also have USD transfers disabled so you can't even withdraw money! I tried to send $47 btc to my Coinbase wallet and they stole $20 of it, so only $21 arrived! The chat ""rep"" shay was no help whatsoever. You can see on the transaction hashtag that someone stole the $20! Binance didn't even try to send $47! They are crooks and the only thing I'm grateful for is it was my very first & very last transaction"
2024-03-19 17:08:49,"Good app,, but there's just no technical support to help me. Did not credit my account after making a deposit to my wallet.. so bad. How else can i trust you. Contact support center just tried to blackmail me. I should pay some cash before getting my cash back . 6months ,, no help ... money laundering in the system."
2024-03-28 00:20:59,"What's going on. I can't access my account anymore since I did the passkey thing. It keeps saying, ""I understand."" But It doesn't work. I've cleared cache and uninstall/ installed the app. Still not working."
2024-03-26 07:05:21,"""I've tried logging in 100 times, but my verified account isn't working. What's the issue? Every time, it says 'login from another device.' Please check.""Subject: Continuous Login Issues with Binance App Dear Binance Support, I'm continuously facing login issues with the Binance app despite having a passkey. This is incredibly frustrating and disrupting my trading activities. Please address this urgently. Best regards, Faraz Hussain"
2024-03-27 23:19:15,Waste. Insanely hard and time consuming to withdraw money. the passkey thingy never works. I need to verify using authenticator app and then using email to withdraw my own money. Worst user experience on planet. Switched to another exchange.
2024-03-27 19:03:04,POOR! Often stops working WITH annoying pop up text saying ''Network anomaly please try again'' And why does binance can't catch up the super fast 5G I use I'm sure it's not my internet and its your application which is not perfect! I lost more than 500$ because of this crash
2024-03-08 07:32:25,I was forced into facial recognition as a way of verification and it legit failed ten times and now I have a full day to verify my account. I've been contacted by a developer and told the same thing the app already told me. Deleted and tried again and nothing worked I'm OUTSIDE in broad daylight and not wearing glasses and it still isn't working.
2024-02-14 09:54:42,"My experience using the Binance app on my android phone is Very Very very awful, you need to fix the app , nothing is loading, the app is not associating with my internet connection, it's keep showing me blank for a week now since I downloaded the app on my android phone. But it was working perfectly on iPhone, well I could say it's because I was using the order version on my iPhone and they have been showing me to update the app on my iPhone but I never want to update it. Fix it B, awful ðŸ˜ž"
2024-03-13 11:39:17,"I don't know if this update is not compatible with my device....it doesn't show the icons in the app, keeps showing connection error even after refreshing. Please binance support center, how do I rectify this. I have cleared data storage and cache as well,still the same"
2024-04-16 09:04:24,This is my first crypto exchange app and it was great for some time. Now it is lagging and seems too crammed with features. Other than that it is a great app that I trust.
2024-04-07 02:09:00,"Worst app tbh. When I closed the trade, the margin money didn't come back to my account. It happened twice and I don't know where my $70 went. Trying so hard to make money and idk what to say. And second thing is it is not showing the correct money on my account."
2024-03-27 23:00:55,It has always been a great app untill recently when it refuses to accept a buy limit order to above liquidation point. Many updates keep coming up lately but each time i face a new issue as the last one detailed above.
2024-03-05 08:27:49,"Very detailed app, not missing the desktop version when I use mobile app. The only issue I see, drops too much on network issues. And it doesn't recover even when there is connection. Need to close and restart from the beginning"
2024-03-04 22:41:44,"The latest update today is showing ad before every single page that you go through in the app. If it is only during first launch of the app, it is ok but ad before switching to every page within the app?!! Seriously? Once it is fixed, I will change my rating. Edit: Update seems to have removed the problem with ads... This is good..."
2024-01-23 01:10:22,"This is the ninth day I failed to carry out KYC verification. I have done all the instructions given to me, but still no change. I thought this was the best app about cryptocurrency trading, but it turns out it's not at all. It's not that the application with the largest number of users makes it easy for new users, but instead makes it difficult for users. (Please look at my Binance account so that you can see how many times my account has been rejected)."
2024-04-01 16:35:28,"The app is very heavy; it occupied a very large phone space: almost 2gb for just 1 app; very slow to open; consume a lot of data; n' battery; pls, something should be done about it; thanks."
2024-03-26 13:03:39,"Litterly worst app. I selected auto invest plan with one time frequency and the app bought me slected cryptos with highest prices of the day. I was shocked and when I checked the candle chart data, i found that the rate applied was even higher than the daily high value of one currency BNB. After that the value of my selected cryptos started to decrease which was going high and high just before slection of my plan. I smell that all info on app are scams and A.I based agorithms."
2024-02-15 04:38:03,"I'm Australian citizen and done my KYC so they have all my informations. I wanted to transfer 200$ to my sister using tether because of ease and speed of transfer. they restricted my account (for 1 month) as it mentioned you can't transfer to Iran and it's high risk wallet. It would be good user experience to alert the users, to prevent this uninterntional mistakes. Anyone read T&Cs? This is problem with my account so CS doesn't help you, there is a review team."
2024-04-16 10:45:46,"I have use this app,but it's very fine no any challenges I was faced but the challenges faced to use is for our business, it's very expessive to business need to pay their clients using binance becouse you can't be able to send 3$ and I think binance can add business account feature"
2024-03-27 21:52:28,"It freezes often on my phone, when other large apps like FB seem to work fine! The download doesn't seem to work correctly! Is there another way I can continue to use this fairly good phone?"
2024-03-31 20:55:12,I'm giving this app 2 rates because it doesn't load fast I've freezes and unfreezed it to no avail this apps quality it dropping just look at bybit that came before it the server is fast but binance now the server is slow and if I don't login for over a week if I open the for it to load will be another wahala pro max please try upgrading to a faster server that even if I don't come online for months if I eventually visit the account or app it will load fast.
2024-04-08 09:41:12,"Binance is a good platform. Beware that customer service is extremely incompetent. Also, do not pay for any extra services. I paid for a binance crypto debit card and got zero refund when they discontinued their card services. Borderline scam but that's crypto."
2024-04-10 14:06:09,The app worked fine and I loved it but suddenly i can't log in i tried reinstalling the app restarting my phone and even changing my internet connection but it keeps returning me to the first page i can't even check on my crypto.
2024-03-17 23:24:37,Please move the cancel all orders button from that location. I have tapped it twice by accident. Other than that the app works fine. I can't find it again on the playstore thought.
2024-04-06 17:48:16,"GHS P2P page automatically filter verified merchants. Which put the none merchant at a disadvantage. Becthey want you to verify as merchant with 1000$ as security deposit else 99% of the customers won't see your ad. When you chat their support, they're not willing to help fix it. They just want your money that's all. Which bad for business because of their monopoly power"
2024-04-09 18:03:52,"Great app , education side is very good to do trades with . Also you get vouchers you for just logging in the rewards hub & verifying your account & I love the Word of the day, (WODL) you get points and can share with friends & family & great for memory, too ðŸ˜€ I find this app brilliant for beginners at trading , it's the best app out there , especially if you're just starting off & learning how to trade . Big game changer for the people who want to get an income, too ."
2024-04-15 04:06:38,"pretty cool app, easy to navigate and the accessibility to purchase via fiat currencies using the most local payment options points out how wonderful this app is. good work to the team and developers!!"
2024-04-08 18:44:53,Don't trust this app with your money there a lot of other platforms that you can trust as binance has the dumbest and the most useless customer service that even existed it's crazy you feel like your talking to a dumb automated robot I've dealt with sandbags that has more Sense and reason that this apps customer service never trusting this app again and I'll be moving every single penny o have from this app as soon as I retrieve the money they scammede on there web3 wallet
2024-03-06 15:59:54,"I just updated my Binance app on my android and it's stopped working. It says ""App isn't responding"". I've restarted my phone, still nothing. Please what's the problem? Update: problem fixed. But I'm deducting one star because of the situation your Nigerian customers find themselves in. If they can't transact in Naira, at least, those with dollar accounts should still be able to buy crypto with fiat($) ... Other than that Binance is just perfect."
2024-02-29 16:34:10,"Update: The issue has been resolved promptly. All working fine now. Well done Binance team, thank you. giving you 5* now _/_/_/_/_ After installing the latest update today the app was performing sluggish and had time out errors. Internet connection is good and stable. I cleared cache, rebooted, etc. still the same. uninstalled app and installed new. Now it doesn't even let me log in... ""authentication error"""
2024-03-07 09:52:06,"Binance is the best app to use especially as a beginner. Fast verification, variety of methods of payments, It's user friendly, secure and you can earn in many ways apart from trading in the platform . I recommend it to anyone who's into or want to invest in crypto to see for themselves."
2024-03-15 04:22:23,"Having more and more outages since CZ left/extra features were introduced Update: Favorite spot price list keeps on glitching (jumping up the list) since this year, small but frustrating bug, 03/15 please fix this jumping around in my favorites is why i am starting to tranfer funds from bianance to other exchanges"
2024-02-09 20:21:53,"It's a good application but I gave 2 star because I created a account & after creating, my account under suspicious behaviour from start. I don't know why because I do nothing to cause this to happen. Even I haven't found a solution to this problem. I hope In Future, binance will come up with easy ways to solve such problems. I have sent mail but didn't receive any reply ðŸ˜•"
2024-03-10 12:58:11,"Overal the app does what it was intended for but for some reason it is supper supper slow. Your apis takes years to respond and I have burned money when closing trades. Haven't seen anyone else complaining, yet if it's an issues on your end kindly fix it, I am not getting left behind in this crypto times."
2024-01-24 17:39:22,After the last two updates the app is not working smoothly. Prices are shown differently and price pick is also not fast and accurate during the trade. Price in the chart is not matching with the price heading. Please fix this issue as soon as possible.
