timestamp,reviews
2024-03-13 14:58:44,Very great app but now very very very very slow.I think it needs internet like NASA's 50g++++ internet ðŸ›œ. So please resolve the issue of loading.It takes too much time to open and start trading.Otherwise we are shifting to other platforms.
2024-03-06 21:08:06,Please ad easy payment option I can't add money or buy stock from my card now days everywhere payment system so easy but you make your payment system difficult that's why I have to uninstall This app. Because if I can't buy stock easily then I don't need this app in mobile. Thank you.
2024-02-10 06:34:37,"In p2p Market, it'll be great to have our good and bad feedback about other users on the top where we can find easily since people change their user names and our feedback goes way too below among others' feedbacks. In p2p again, It'll also be great to have an option to see others' p2p trading Volume where users can decide to show and not to as they wish. Since some ppl spam completion rate with tiny amount. And I don't think showing our trading volumes to others isn't such a big deal."
2024-01-21 06:38:49,"The platform's ease of use has significantly enhanced my experience, making it stand out as the best among various cryptocurrency exchanges. However, I encountered a restriction indicating that I am not eligible to participate in certain activities. I would appreciate guidance on how to become eligible for these activities, as I value the services provided by Binance and would like to explore the full range of offerings. Thank you for your attention and assistance."
2024-04-08 07:11:31,"If it had 1-2â‚¬ fees by putting money in binance with card like sepa it would be perfect, 2% fees are to much by my opinion. Overall it's very nice and accurate. â˜ºï¸"
2024-04-12 20:42:35,"In a sea of trading apps, Binance is a lighthouse guiding us to better productivity, enhanced connectivity, and more fun I ever enjoyed. It's a rare gem that promises and delivers. Give it a try, and watch it exceed your expectations."
2024-03-27 11:19:12,"Used this app for years, every time some update comes out you seem to remember all my credit card details yet I need to verify, I tried 20+ times yet you don't get I'm not from America and don't have ID from there, I'm not happy at all how hard you have made it and want to take MY money out"
2024-03-26 17:45:33,"Great for trading cryptocurrencies. However, I would like to see charts for coins easily from my spot wallet, earn wallet, funding wallets area for coins I am holding instead of going to the market area. This update will make the app a 5star for me."
2024-04-10 09:09:10,"Please each time it requires update, the bytes increases and it slow while using minimize the byte and improve on fast and usability of the app. Thanks"
2024-03-26 11:13:16,Overall good in binance wallet but when I try to connect/open web3 wallet it always crashes. I am unable to open web3 wallet from two months. Please do something for this. I didn't get any solution from ðŸŽ§.
2024-04-09 16:18:09,"Great exchange, terrible Web3 Wallet. The web3 Wallet is just the worst of all the options right now. It seems they kick you out of the Binance ecosystem the moment you try to get your private keys. Can't import your wallet back as there are no seed phrases"
2024-03-31 03:18:31,"Right now, the app seems sort of legit, however the verification sucks. Ive been trying for 3 days to verify and have this far been unsuccessful, if i manage to get past verification, i will definitely up the rating"
2024-03-27 00:39:34,"Hello Kumar, Thank you for the contact, we are willing to collaborate in the completion of the Verification process, please attach to the message and submit: Photo of your Smart National ID Card or Passport. Selfie photo holding the chosen Identity Card. - Check the quality of the images: Before submitting them ensure that the images are of high quality, make sure that the information can be read clearly. - Documents: both sides, document edges visible, no electronic documents, not scanned,"
2024-04-04 23:56:24,"I'm no expert but Binance is pretty easy to understand, has lots of features and almost all coins are here. Been using this for years."
2024-03-29 02:15:51,"Out of all the crypto apps, least user friendly. Constant glitchingbin Web3 wallet, won't let you transfer coins to other platforms. ðŸ‘ŽðŸ¿ðŸ‘ŽðŸ¿ðŸ‘ŽðŸ¿"
2024-04-07 00:12:32,"I cant login, it constantly reloads the login page. Tried clearing cache, reinstalling and restarting phone. Doesn't work."
2024-03-30 17:41:59,"I can't login to the ID after clearing the data of the app. When i log in, it says not available pass key. After many days, I am able to log in again with Gmail ID, but when I try to log in with my phone number, it says Not Available Pass Key. What can I do now?"
2024-03-29 21:25:56,I can't login my account with my email or phone number since I updated my app.. it keeps telling me verification ID fail ðŸ™ƒ and also my details has be use for another account... please do something about it it frustrating
2024-03-27 22:04:27,Overall the app is user friendly. Customer service is great. I recently got wonderful and quick help from them.
2024-03-26 13:33:31,Binance is the best Platform to Trade crypto but in this version of App there is something wrong ðŸ˜­ when I start app it starts smoothly but after few moments it hang and auto restart. I requests Binance Team please check it . Thanks
2024-04-09 15:42:01,"Hi Binance support I am suffering login issues by last few days, When ever I starts logging in binance App crashed all the time, I had suffered huge loss of time and trades, What i have to do? I had tried all trouble shooting methods but its still didnot worked."
2024-04-03 10:15:27,Hi am reaching out again this is the worst version of binance full of bugs and stopping all the time i have cleared the cache like a million times but nothing is fixed
2024-04-01 11:21:04,"I've been trying to do my verification, but it just brings up a blank page...... I don't find the response useful, I've cleared the cache several times now, but still no yields. ðŸ˜¡"
2024-03-26 16:29:26,This is the stupidest verification I've ever seen in my life I uploaded everything they requested for me to verify my account but yet the video will not be accepted what kind of a stupid app is this If you guys don't reduce your long denied verifications customers will keep on switching to another app just like I'm about to
2024-04-13 21:21:25,This version very bad. It means clik any news or something els and open news then go back to home screen and this work back to back every time
2024-03-26 08:34:17,Binance please you people should fix your app I don't understand what is happening the app keep crashing I have uninstall and reinstall but same issue is telling me network issues... But If i access other platform is working fine .. please why...
2024-04-06 06:49:48,"Horrible app expirience never has it been so hard to deposit to my bank account, if you're planning to use binance I recommend you any other app than binance, save yourself from problems and issue's."
2024-04-01 13:09:57,The app is great for buying and selling crypto currency.its also good for p2p trading.theres only one problem everytime I open the app it take too long to showing screen. Please fix this problem
2024-04-07 14:57:21,"These days binance application is not working properly. From two days I'm not able to claim any red packet code. Only it's showing connection error, try again laterðŸ˜ª. Please help me"
2024-03-27 06:39:55,I am unable to verify my identity ID when I try it takes me to a blank page where nothing pops up I tried un installing the app and installing it but there was no difference still the same problem
2024-03-27 14:42:08,"Its a game or a scam I always buy any at down trend and I wait for uptrend,I always sell that at up trend but whenever I saw my balance it gowing down and down every time, This app ask that no fees at convert so why?ðŸ˜ ðŸ˜ "
2024-04-08 03:21:50,With any updating getting more trouble about depositing and withdrawing crypto. Last 2/3 years was very easy but now i can't deposit and withdraw on my binance app. Lot of times i tried to upload my documents but rejected ðŸ˜”.
2024-03-28 18:59:26,"I like the fact that there is a simple mode and a advanced mode, but to buy minimum is too much Binance"
2024-03-30 06:23:40,"Why is my app refusing to load, my connection is good I have even updated the app yet it keeps saying network annomaly. Thanks developer, I cleared cache and it opened."
2024-04-01 05:12:32,I just opened Binance account not only does it keep crashing which stopped I can't seem to verify my account... The verification process does not work pls can you fix this
2024-03-24 09:25:04,You App does not display charts and need to re-start. Most of the time Hangs. Reinstalling did not help
2024-03-30 02:59:27,The World ðŸŒ Best Best App for currency exchange. But How I earn from it I don't know & don't understand ðŸ¥ºyet still my favorite app I've been using this about 2 years. Most Trusting app most recommend.
2024-04-12 09:48:51,"After update, everything I open in binance automatically stop and then closed then give error hanging issue also clear cache many time but still problem not solved."
2024-04-10 15:17:16,"Very good, It would be even better if it have more security choice for user and upgrade its server. It would make the app faster"
2024-04-01 06:39:14,Each time i try to log in to my account it keeps on responding verification failed that i should contact your support team. What could be the issue?
2024-03-31 20:44:04,P2P customer service is no help at all! No security measure for the buyer if the seller is unresponsive for more than many hours!!!!
2024-04-07 04:51:41,app crashes as i am clicking on show more in front page of app discover section? Kindly fix the issues and upload the latest build still there is issues in old version of Android
2024-04-10 09:05:14,"Cleared cache, reinstalled the app and switched from wi-fi to cellular data and still I can't access my web3 wallet, with my assets. So, do something!"
2024-04-12 12:33:47,very good experience I like it very much but sometimes there is unknown eror exist and future account withdrawal cotain error and I want to insure these aror does not occur in future.
2024-04-10 07:20:00,I've updated the new update several times but it keeps asking me to update again and it's annoying because much of my data is being wasted.
2024-01-27 17:17:43,"This was the only way I could reach out to life binance support team ,have complain several times about my binance account been band from p2p trading have tried so many times to unlock it but dey keep on showing error 403 forbidden-(this request is blocked for security reasons you can't connect to the server for this app or website ) I have tried clearing my cache even deleted and reinstalled the app even loged in with different phone it's still the same plis I need ur help plis pls tnx."
2024-03-25 21:37:37,"I give you three stars because it is good since have downloaded it,,but like 2 weeks ago now ,,,it telling me connection error,,I refreshed it several times same thing ,,and have update it,,,have clean cache,,even Ramadan gift,,,I can't receive it and my sim connection is okay ,,, please help us reset the app network oooo"
2024-03-31 09:35:59,"I love this apps it's reliable, secured, and trustworthy. I used this apps over five years now but when I heard that it will be banned in the Philippines I consider to look for another platform out there. I have funds that can't be transfer from here due to locked in period of over a years. Hope this apps will not be banned."
2024-04-04 05:08:25,Got scammed on first transaction while trying to buy from P2P Thanks to binance. forcing us to trust random people while not allowing bank credit/Debit card transactions. When i complained they favored the scammer and canceled my order.
2024-02-02 05:39:32,"Best exchange in world of crypto exchange, P2P and trading. No doubt. I have not yet encountered any bug or any issue with the app or the transaction. Seemless transactions upto date. I wish binance stay up to the mark ofthe best in the world.. Appretiation review.. This is my genuine review through experiencing this app.."
2024-04-04 23:33:39,I feel the app could be made better by adding feature telling the user net invested and profit more financial clarity sell cost.... Apart from that I really like the app
2024-04-05 10:52:45,"Why I can't participate in launchpad? When ever I want to open launchpad it shows me error. I did refresh again and again even though today I updated app again but launchpad doesn't work , how can I fix this issue?"
2024-01-31 11:50:01,"When trying to login it asks me for a sms, email or google authenticator verification. When I try to submit the codes, submit button is greyed our and does not work. Now my money is trapped there. Support doesnt answer. Stay away from binance until they fix this app. Edit: they have fixed it."
2024-04-09 06:50:16,"I just so much love the interface, the prompts. very suitable for newbies. I like this App more than the website."
2024-02-28 04:14:16,interface design good. but I can't handle easily. And payment option is not available so I can't transfer amount with my account from binance.
2024-04-06 07:01:16,"I feel that u guys are the best,but u should also try and help people to save up their username or password inorder for them not to find it difficult login in"
2024-04-08 10:41:24,"Dear binance team... for spot treading, please add an option of take proft and loss option. same as ur providing on future treading..it will be very useful for all community.."
2024-03-05 18:44:39,a very reliable a s secure app with tons of features. I like the fact that I can swap across multiple tokens as easily as possible and get very low transaction fees with very intense levels of security on my account. I love Binance
2024-01-23 15:32:33,"I can't withdrawal my money already a month. Always says service not available. What a scam. 1). Tried web version, doesn't work. Anyway you can keep the money, it's not a big amount. I simply don't have time to spend with your chat and support."
2024-04-10 09:38:47,"One of worst experience i ever had, the app is getting crash again and again i have updated it from play store but doesn't work"
2024-02-16 09:44:21,I have deposited 10 euro four promotion 30 euro extra .now my original 10 euro I find no record of it ..I am down 10 euro ..I don't know what to ..this app is too complicated ..and there is nothing to call customer service that I can directly call. Anyone knows what to do ? I know 10 euro is not much but if I cannot believe this app for 10 euro then what about 1000 or more ??? I am very disappointed ðŸ˜ž ðŸ˜”
2024-02-19 12:25:18,I have high speed Internet connection and its showing me network anomaly try again later while baybit open in one second pls fix this bug and also fix the stop order just close the stop ordrr on exact what we set don't push our loss high
2024-02-13 10:08:02,Worst app I have seen ever . They take deposit and when it's time to withdraw they suspend your account. Customer service is not there fro solving problems they are there for creating problem. Once you encounter one problem they will create another problem for you . Even though it is your account but it is under control of customers service.
2024-03-27 21:23:07,"I think this is great. The transactions are amazing. However, value for assets as applies to money. That's the only puzzle."
2024-03-23 13:13:59,"What's really wrong with binance this days in Nigeria? Now the app is no longer loading. Whenever you tried to log in. Automatically it will log u out, I update , I uninstall . Yet still doing the same thing /, I'm really tired with the app"
2024-03-13 16:48:08,I have been using it almost six years now. I have never exprienced any problem. It easy to withdraw and to make deposits. My funds are more than 100% secure. I am so lucky to be investing in this platform. It is the best of the best
2024-03-27 14:24:00,unfortunately binance has loads of bugs at the moment I cannot log in session keeps expiering and logging out 30 seconds into verification.. looks like I have to use coinbase witch is a shame because binance is the best .. obviously so issues in house
2024-04-01 08:26:23,"After updating my Binance, which I did up to three times. My app now report no network,Which I have never experienced such before. I really need to login to my account.."
2024-04-12 04:49:58,Hallow all I have increased my â­ up to 5 as this exchange is 100% working very well you can do everything in one app wonderful hop for the developers keep is up the good work easy deposit easy withdrawal powerful security.
2024-03-10 20:59:26,"once you get your head around trading it's easy, look up some tutorials first, and don't put in what you can't afford to loose, do it for fun and it will be fun, good luck."
2024-04-13 05:29:51,I've been using Bianca for the past years but don't know whats wrong now coz when i go to p2p and try to buy or sell USD mpesa is not being included as means of payment and in the past it was there....please try to fix that
2024-03-15 18:14:10,"This is not the binance I used to know. Now the app refused to allow me login saying I should contact support, even though no provided means of contacting the support. Now am stranded with all my funds locked in there. Nothing to do now. This is really frustrating."
2024-03-04 14:56:05,"This is the first time ever I am experiencing this crash on BINANCE over the years of my usage, I have uninstalled and reinstalled it but the issue still persists, please kindly resolve it because I am losing a lot of cash ."
2024-03-16 04:22:07,"App login verification popup shows up again and again. If you are already verified, you put the passkeys etc (login process) it still says to login again and again. Login popup never goes back having options to logout instead. LoL Why it says logout without making me to logged in."
2024-04-07 01:46:58,Been using this app for years and was good but lately always crashing for more than a month now or two can't do anything. Getting tired of it
2024-03-11 17:56:18,"The App is nice but I will advise developersof this App to add a security feature to the app where the user will be asked to input access PIN / Password or thumb print to be able to access the app thereby creating a security level so as there won't be any unauthorized use or transactions on one's account. If this feature is implemented, I will come back to give a 5 star"
2024-03-07 10:55:50,I trust it is a world top best wallet I alawys recommend this app with my relative its fully ensure trusted exchanger wallet but I face problem some few days ago payeer to binance very esay deposit rubble other etc. But at a time there is no option to deposit payeer to binance. I could not expect this from Binance. I hope Binance again add this option
2024-03-18 18:43:51,"my account is on verify mode from last a month, tried multiple times but still couldn't gain full access to my account. poor service, and support."
2024-03-10 08:29:05,great platform to start trading and also has a lot of chances to learn and earn crypto currency while learning. I have started and not knowing what I was doing but all in all I never claimed any rewards from the app at the start and have tried by all means to learn. I give it 5 star because I have a little knowledge now of how the world of crypto works. All thanks to Binance. I recommend this app to everyone. I would love to have someone to teach me how to become rich on the app without deposit
2024-03-20 11:27:38,"Thank you for your response. Another challenge I'm having in the app is not able to disable my dual investment auto compound. Given the fact that Nigerians can't access binance website, and the auto compound can't be edited via the app"
2024-03-26 01:32:11,I have a very bad experience after installing this app when I tried to sign up its been 10 hours since it is just buffering and no result
2024-03-19 10:40:39,"Every time when there are unusual movements in the market, the system gives an anomaly error, and I can't make transactions and I lose money. Horrible"
2024-04-12 06:24:03,"Definitely your having problems now. Anytime update and when updated there will be limited development. ðŸ¥µ This problem ""limited anormally"" must be fixed!"
2024-03-18 14:16:47,Please prompt a message when selecting zen payment in which to inform users who are not familiar with zen to check or verify zen account because the funds may be there and additional fees may be applied in 3rd party payment procesor. I have selected zen because it was stated that there are no fees. I would've selected bank transfer and the fees would have been much lower. It may be misleading. Thanks for understanding
2024-04-03 03:59:27,"I don't like the fact that I can no longer open the app anytime I want, it keep on saying network anomaly please try again so annoying"
2024-03-31 06:54:56,So many glitches coming in my app i was going to close trade with big loss even after refreshing these glitches are not going Request to binance team please fix this issue thanks
2024-03-16 09:54:46,"Reinstalled after a bad experience and got it working. Finally!!! It's a little weird as a beginner in crypto, but it's just manageable. Thank you Devs. Your prompt response to my initial bad review has won me over."
2024-02-19 19:07:22,"Very good application, but the worst customer service [Edited after their reply] You just answered my rating 3 years later, telling me to open a ticket and solve my problem dated 3 years ago. Confirmation level +999. Good job! You just lost one more star."
2024-02-29 19:14:15,"The app has been having issues loading completely and it always seems like it'll load till eternity as after opening the app, about 85% of the app's interface goes blank."
2024-01-27 09:51:52,"After the last update it asks me to login everytime I try to open the app. And most important I lost access to my wallet in the app. When I try to access it, it asks me to log in again and after it says ""Network unreachable"". PS: Had to uninstall and install again the app. PS: 01.2024 I would like to thank the developer team for being so prompt in following up my problem. It only took them 3 years :)))"
2024-03-24 23:51:09,Very bad app. passkey just playing. in fact binance is a data scammer app. then only stall data and nothing else.
2024-02-20 05:42:19,"The biggest and safest exchange, but the server connection is very slow, sometimes network anomalies, sometimes data malfunctions, Sometimes Crash, Sometimes the price chart doesn't work, deleting the cache is also useless. and even when I browse other exchanges such as Mexc, BingX, Bybit, Huobi, Gate, Kucoin etc. I didnt experience anything similar when I was on Binance. the servers there are much better and also the last price trade here is also very bad, they wick very far from the last price"
2024-01-20 18:45:50,"I just love it. There are numerous elements that set Binance apart from other programmes. I use it because it contains several currencies that are unavailable in other applications, and it is simple, safe, and significantly more affordable than others. It really is the greatest app for trading digital currencies."
2024-04-09 22:50:18,Am so much having difficulties depositing in my binance... It kept telling me my card isn't supported after I put my card number... It's really frustrating; I can't even start trading yet.
2024-02-07 15:34:29,"The app is terrible especially when trying to login with the security feature from the authenticator app,it keeps refreshing back to step 1 instead of taking you where you left off to paste the code"
2024-01-30 06:54:29,Takes forever to verify my account been stuck for hours can't upload my id I wasted a lot of time. Edit : I opened the app the next day I couldn't find my id picture in gallery! The app literally messed up with my phone. ðŸ¤¦ðŸ»â€â™€ï¸
2024-04-08 23:24:13,It's increasing storage size day by day after installation and server is too much slow. Should to reduce fees and charges. Please manage online prepaid card for all countries if not possible physical/plastic card.
2024-04-13 09:18:41,Giving 1 star till... Floating window revamping like okex excahnge.. and why my floating window list deleted after every update ... Every time after update i again adding my watchlist.. kindly fix it
2024-03-26 22:26:40,"Keeps crashing I reinstalled, updated,clear storage and cache but still crash I think I'll switch to okx"
2024-04-04 10:40:32,"Binance is a really good app but there are some certain features which other apps are offering, Binance should work on them also."
2024-03-27 13:52:24,Any time i try to login and leave the app so that i can copy the verification code from my email address the app crashes so i have to start the login process from the beginning
2024-04-07 12:53:57,I have been using binance for a while but the app have start misbehaving once I login the app won't load everything will be blank I am tired of this rubbish fix your app or tell the app users to withdraw their money and shut this thing you call app down ðŸ˜ ðŸ˜ ðŸ˜¡ðŸ¤¬
2024-04-15 10:03:51,"This is the best platform I have ever used, it has good and immediate customer support. but it's loading time is annoying"
2024-04-01 09:59:00,"The gift card thing isn't working at all. Tried to clear the cached data and reinstall, but nothing changed"
2024-04-12 06:51:21,Some of the features are not even working like trailing stop I have tried and waited 3 hours to test and its not working.
